{
  "family_annotation_version": "synthetic-v1",
  "family_id": "syn_f05_alternative_route",
  "full_set_satisfiable": true,
  "leave_one_out_cases": [
    {
      "removed_evidence_id": "s3_speech_route_b",
      "retained_evidence_ids": [
        "s3_cobalt_arrow"
      ],
      "still_sufficient": false,
      "unsupported_claim_ids": [
        "claim_syn_f05_alternative_route"
      ]
    },
    {
      "removed_evidence_id": "s3_cobalt_arrow",
      "retained_evidence_ids": [
        "s3_speech_route_b"
      ],
      "still_sufficient": false,
      "unsupported_claim_ids": [
        "claim_syn_f05_alternative_route"
      ]
    }
  ],
  "minimal": true,
  "minimality_result_id": "minimality.syn_f05_alternative_route.ses_syn_f05_alternative_route_2",
  "schema_version": "1.0.0",
  "set_id": "ses_syn_f05_alternative_route_2",
  "strict_superset_of_accepted_set_ids": []
}
