{
  "family_annotation_version": "synthetic-v1",
  "family_id": "syn_f08_count_status",
  "full_set_satisfiable": true,
  "leave_one_out_cases": [
    {
      "removed_evidence_id": "s4_speech_count",
      "retained_evidence_ids": [
        "s4_speech_status"
      ],
      "still_sufficient": false,
      "unsupported_claim_ids": [
        "claim_syn_f08_count_status"
      ]
    },
    {
      "removed_evidence_id": "s4_speech_status",
      "retained_evidence_ids": [
        "s4_speech_count"
      ],
      "still_sufficient": false,
      "unsupported_claim_ids": [
        "claim_syn_f08_count_status"
      ]
    }
  ],
  "minimal": true,
  "minimality_result_id": "minimality.syn_f08_count_status.ses_syn_f08_count_status_1",
  "schema_version": "1.0.0",
  "set_id": "ses_syn_f08_count_status_1",
  "strict_superset_of_accepted_set_ids": []
}
